Text,Questions,Answers
"ඇමරිකාව ස්වදේශික ජනතාවට ඇමරිකාව පෙර කොළොම්බියානු වැසියන්ගේ පැවත එන්නන්. Pueblos indígenas (දේශීය ජනතාව) ස්පාඤ්ඤ භාෂාව කතා කරන රටවල පොදු කාලීන වේ. ""Amerindian"" ක්විබෙක්, මෙම Guianas, සහ ඉංග්රීසි භාෂාව කතා කරන කැරිබියානු භාවිතා වේ බැවින්ද Aborigen (ආදිවාසී / දේශීය), ආර්ජන්ටිනාව භාවිතා වේ. දේශීය ජනතාව පොදුවේ පළමු ජාතීන්ගේ සංවිධානය, උප්පත්තියෙන්ම, සහ Métis ජනයා ඇතුළත් ආදි වාසී ජනයා ලෙස කැනඩාවේ හඳුන්වනු ලැබේ. එක්සත් ජනපදයේ දේශීය ජනතාව පොදුවේ ස්වදේශීය ඇමරිකානුවන් හෝ ඇමරිකානු ඉන්දියානුවන් හා ඇලස්කාව ස්වදේශිකයන් ලෙස හඳුන්වනු ලැබේ.","[ 'ඇමරිකාව ආදිවාසීන් පැවත කවුද?', 'කතා කරන ස්වදේශික ජන සඳහා රටවල් ස්පාඤ්ඤ පොදු කාලීන යනු කුමක්ද?', 'කුමක්ද කාලීන ආර්ජන්ටිනාවේ මහද්වීපයක් මුල් ජනතා හැඳින්වීම සඳහා ද යොදා ගනී?' 'දී ක්විබෙක්, මෙම Guianas හා ස්ථාන ඉංග්රීසි කතා කරන කැරිබියානු, කුමක් ඇමරිකාව, දේශීය ජනතාව සඳහා වඩාත් කැමති කාලීන ද?', 'කොහොමද වඩාත් සුලබ එක්සත් ජනපද පුරවැසියන් විසින් සඳහන් ආදිවාසීන් ද?']","[[{ 'පෙළ' 'ඇමරිකාව කලින් කොළොම්බියානු වැසියන්', 'answer_start': 66}], [{ 'පෙළ' 'Pueblos indígenas', 'answer_start': 109}], [{ 'පෙළ': 'Aborigen', 'answer_start': 196}], [{ 'පෙළ' 'Amerindian', 'answer_start': 256}], [{ 'පෙළ' 'ඇමෙරිකානු ජාතිකයන්', 'answer_start': 524}]]"
"රතු තැඹිලි හා ප්රතිවිරුද්ධ දම් ආලෝකය ඊළඟ දෘශ්යමාන වර්ණාවලිය අවසානයේ පාට. රතු වර්ණ දළ වශයෙන් 620-740 නැනෝමීටර ක අතිප්රමුඛ ආලෝකය තරංග ආයාමය ඇත. රතු දෘෂ්ය ආලෝකය ආකලන ප්රාථමික වර්ණ රතු, කොළ, නිල් (RGB) වර්ණ පද්ධති සඳහා පරිගණක තිරය හෝ රූපවාහිනී තිරය මත ඇති සියලුම වර්ණ නිර්මාණය කිරීමට ඒකාබද්ධ කරන කොළ වර්ණ සහ නිල් සමග එක් වේ. රතු ද subtractive ප්රාථමික වර්ණ එක්, කහ සහ නිල් සමග, චිත්ර ශිල්පීන් සහ කලාකරුවන් විසින් භාවිතා කරන RYB වර්ණ අවකාශය සහ සාම්ප්රදායික වර්ණ රෝද වේ.","[, 'මොකක්ද වර්ණ අසල දෘශ්ය වර්ණාවලියේ රතු ඇත' රතු සොයාගෙන ද? කොහේද, ආලෝකය වර්ණාවලියේ මත, '' ආලෝකය කුමක්ද වර්ණාවලිය තුළ රතු? ',' රතු ප්රතිවිරුද්ධ දෘශ්ය වර්ණාවලියේ මත කොයි වර්ණ? ', ආලෝකය? ක ',' රතු, කහ හා නිල් වර්ණ ආකාරයේ මොනවාද? ',' පාට ප්රතිවිරුද්ධ තැඹිලි හා දෘශ්ය ආලෝකය වර්ණාවලිය මත දම් ඊළඟ යනු කුමක්ද? ',' නැනෝමීටර 640-720 ක අතිප්රමුඛ ආලෝකය තරංග ආයාමය ඇත්තේ කුමන ? ',' කුමක්ද RBG වෙනුවෙන් පෙනී කරන්නේ කුමක්ද? ']","[[{ 'පෙළ' 'දෘශ්ය ආලෝකය', 'answer_start': 47}], [{ 'පෙළ' 'වයලට්', 'answer_start': 89}], [{ 'පෙළ' '620-740 නැනෝමීටර' 'answer_start': 153}], [{ 'පෙළ' 'තැඹිලි', 'answer_start': 69}], [{ 'පෙළ' 'subtractive ප්රාථමික වර්ණ', 'answer_start': 409}], [], [], []]"
"ඊජිප්තුවේ, (i / iːdʒɪpt /; අරාබි: مصر මිස්ර්, ඊජිප්තු අරාබි: مصر Maṣr, කොප්ටික්: Ⲭⲏⲙⲓ Khemi), ඊජිප්තුවේ නිල වශයෙන් අරාබි ජනරජය, අප්රිකාවේ ඊසාන කෙළවරේ ඇදී යන transcontinental රට වන අතර, ආසියාවේ නිරිත දිග කෙළවරෙහි, හරහා සීනායි අර්ධද්වීපය විසින් පිහිටුවන භූමි පාලමක්. එය ලෝකයේ පමණක් යාබදව Eurafrasian ජාතියකි. වර්ග කිලෝමීටර 1,010,408 (වර්ග සැතපුම් .390,000) නයිල් නිම්නය තුළ බොරු ඊජිප්තුවේ භූමිය බොහෝ. ඊජිප්තුවේ මධ්යධරනී රටක්. එය ගාසා තීරයේ හා ඊශ්රායලය විසින් ඊසාන Aqaba බොක්කේ නැගෙනහිර රතු මුහුද නැගෙනහිර සහ දකුණු බටහිරින් දකුණු සහ ලිබියාව මායිම්,,, සුඩානය.","[ 'කුමක්ද මහද්වීප 2 ඊජිප්තුව හමුවීමට?' 'ආසියානු හා අප්රිකාව අතර කුමක්ද භූමි පාලමක්?', 'කොහොමද විශාල ඊජිප්තුවේ ද?', 'මුහුද, නැගෙනහිරින් ඊජිප්තුවට මායිම් කුමක්ද?', 'රටට දකුණු ඊජිප්තුවේ මායිම්? ']","[[{ 'පෙළ' 'අප්රිකාවේ සහ ආසියාවේ නිරිත දිග කෙළවරෙහි', 'answer_start': 191}], [{ 'පෙළ' 'සීනායි අර්ධද්වීපයේ', 'answer_start': 260}], [{ 'පෙළ' ' වර්ග කිලෝමීටර 1.010.408 ',' answer_start ': 360}], [{' පෙළ '' රතු මුහුද ',' answer_start ': 564}], [{' පෙළ '' සුඩානය ',' answer_start ': 595}]]"
"විචිත්ර 3 වන සහස්රයේ දී මෙසපොතේමියාවේ ආරම්භ දිගු ඉතිහාසයක් ඇත. ගල් කැටයක් මොසායික් Mycenean ග්රීසියේ Tiryns සිදු වූ බවත්; රටා සහ පින්තූර සමග මොසායික් පුරාණ ග්රීසියේ හා පැරණි රෝමයේ දෙකම, සම්භාව්ය කාලයේ පැතිර බවට පත් විය. 4 වන සියවසේ සිට මුල් කිතුනු බැසිලිකා සිට බිත්ති සහ සිවිලිම මොසායික් සරසා ඇත. 6 වන සිට 15 වන සියවස දක්වා, බයිසන්ටයින් අධිරාජ්යයේ විචිත්ර කලා මල් පල දැරීමක්; බව සම්ප්රදාය 12 වන සියවසේ දී, නැගෙනහිර-බලපෑම් වැනීසිය විසින්, සහ යුක්රේනයේ RUS අතර සිසිලි දී නෝමන් රාජ්යය විසින් සම්මත කර ගන්නා ලදී. රෆායෙල් වැනි කලාකරුවන් දිගටම පැරණි තාක්ෂණය පුහුණු වීමට වුවද විචිත්ර සිදු විලාසිතා, ඉන්පසු කාලවලදී පහත වැටී ඇත. රෝමානු සහ බයිසන්ටයින් බලපෑම යුදෙව්වන් මහලේ මොසායික් සමග මැද පෙරදිග 5 වන සහ 6 වන සියවසේ ධර්මශාලාවල සැරසීම සඳහා හේතු විය.","[ 'මෝසෙස්ගේ කුමක්ද සහස්රයේ ආරම්භ කළේ?', 'වගේ විචිත්ර මොන Tiryns සිදු කරනු ලැබ ඇත?', 'රෝම හැර යුදෙව් ජනතාව විසින් බලපෑම් ලැබුණේ කෙසේද කවුද?', 'ද නෝමන් දේ ඉතාලි නගරය රාජ්ය kingdomwas?', ' විට විලාසිතා විචිත්ර වැටීම සිදු වුණේ කොහොමද? ']","[[{ 'පෙළ' '3 වන සහස්රයේ', 'answer_start': 54}], [{ 'පෙළ' 'Pebble මොසායික්', 'answer_start': 77}], [{ 'පෙළ' 'බයිසන්ටයින්' 'answer_start': 695}], [{ 'පෙළ' '' සිසිලිය '', 'answer_start': 481}], [{ 'පෙළ' 'මෙම පුනරුද', 'answer_start': 599}]]"
"මුල් ලතින් වචනය ""universitas"" ""ආදිය, එකම ශරීරයට සම්බන්ධ පුද්ගලයන් ගණනාවක් ඇති සමාජයක, සමාගම, ප්රජාව, සංසඳය, සංස්ථා,"" පොදුවේ සඳහන් නාගරික නගරයේ ජීවිතය ඉස්මතු හා මධ්යතන වීමක් තිබිණි එම අවස්ථාවේ දී, ""ඔවුන් පිහිටා කරන ලද නගර සාමාන්යයෙන් අධිපතීන් විසින් නිකුත් කුලී විසින් සහතික සාමූහික නීතිමය අයිතිවාසිකම් සමඟ සිසුන් සහ ගුරුවරුන් සමිති, සමාගම්, හිමිවරුන්, හෝ"" විශේෂඥ මෙම විසින් දරනු ඇත පැමිණි පොදු යෙදුම. වෙනත් වීමක් තිබිණි මෙන්, ඔවුන් ස්වයං-නියාමන වූ අතර ඔවුන්ගේ සාමාජිකයන් සුදුසුකම් තීරණය.","[ 'භාෂාව සිට Universitas ආවේ කෙසේද?' '' 'කරුණු දෙකක් වචනය universitas පවතින බවට පත් කිරීමට ආරම්භ කළේ කුමක්ද? මුලදී පමණ', 'මොන universitas සමාන වීමක් තිබිණි සමග පොදු සිදු වුණේ ඇයි?', 'පුද්ගලයින් සාමාන්යයෙන් කුලී අනුමත කුමන universitas සඳහා ද? ',' කුමක්ද විශ්ව විද්යාල සඳහා කර ඇති මුල් ග්රීක් වචනය ද? ',' කුමක්ද වීමක් තිබිණි කිරීමට කුලී නිකුත් කවුද භූසියේ වැඩ ""universitas"" අදහස්? ',' කරන්නේ? ',' කොහොමද වීමක් විශ්ව විද්යාල වෙනස් වුණේ කොහොමද? ',' භාෂාව දේවල් දෙකක් පවතින බවට පත් කිරීමට යන වචනය ඉස්මතු ආරම්භ කළ දේ මුලදී පමණ ""ඉස්මතු"" ආවේ කොහෙන්ද? ',' කරන්නේ? ',' මොන ඉස්මතු පොදු සමාන වීමක් තිබිණි සමග පුද්ගලයින් සාමාන්යයෙන් අනුමත කුමන සිදු වුණේ ඇයි? ',' ජෙනරාල්වරු සඳහා කුලී? ',' කුලී විසින් කුමක් සහතික නැත? ']","[[{ 'පෙළ' 'ලතින්', 'answer_start': 13}], [{ 'පෙළ' 'නාගරික නගරයේ ජීවිතය සහ මධ්යතන යුගයේ වීමක් තිබිණි', 'answer_start': 195}], [{ 'පෙළ' 'ඔවුන් '' අධිපතීන්, නා හිමිවරුන් බැහැ ',' answer_start ': 353}], [], [], [], [], [], [: ස්වයං නියාමන', 'answer_start විය පෙළ' [{477}] ' ], [], [], []]"
"පොදු ආගමේ priesthoods ප්රභූව පන්ති සාමාජිකයන් විසින් පවත්වන ලදී. පැරණි රෝමයේ පල්ලිය හා රාජ්යය වෙන් කිරීමට කිසිදු ප්රතිපත්තියක් ප්රතිසම ඇති විය. රෝම ජනරජය (ක්රි.පූ 509-27) තුළ, රජයේ නිලධාරීන්, ද යහපැවැත්මට හා pontiffs ලෙස සේවය පිණිස තේරී පත් වූ එකම පිරිමි. පූජකවරු, විවාහ පවුල් මතු, සහ දේශපාලන ක්රියාකාරී ජීවිත විය. ඔහු කොන්සල් තේරී පත් විය පෙර ජුලියස් සීසර් විද් මැක්සිමස් බවට පත් විය. මෙම යහපැවැත්මට දෙවිවරුන්ගේ කැමැත්ත කියවා විශ්ව සාමය පිළිබිඹු ලෙස සීමා මායිම් පිළිබඳ ඇති ලකුණු අධීක්ෂණය, මේ අනුව, දිව්යමය ඉරණම පිළිබඳ කාරණයක් ලෙස රෝමානු ව්යාප්තවාදයට අනුමත. එහි හරය රෝම ජයග්රහනයක් ජයග්රාහී පොදු ගරුකළ හා සාධාරණ පාලනය මූර්තිමත් කරන දෙවිවරුන්ට තම කොල්ලය කොටසක් කැප විසින් පොදු යහපත සේවය කිරීමට ඔහු තුළ ඇති කැමැත්ත, විශේෂයෙන් බ්රහස්පති, ප්රදර්ශනය කරන ආගමික පෙරහැර විය. මෙම Punic යුද්ධ (ක්රි.පූ 264-146) ප්රතිඵලයක් වශයෙන්, රෝමයේ අධිපති බලය ලෙස තහවුරු කිරීමට වෙහෙස වන විට, නව විහාරස්ථාන බොහෝ දේවත්වය භාරයක් ඉටු මහේස්ත්රාත්වරුන්ගේ ඔවුන්ගේ මිලිටරි සාර්ථකත්වය සහතික සඳහා ඉදි කරන ලදී.","[ 'කුමක් පන්තියේ සාමාජිකයන් පැරණි රෝමයේ පූජකයන් ද?', 'මොන වගේ දේශපාලන වෙන් රෝමයේ පහව ගොස් තිබේ ද? ',' කුමක්ද රෝම ජනරජය කාල පරිච්ඡේදයක දෙවියන් වහන්සේ රෝම සඳහා පමණක් පාලනය ගෙනදෙමින් කුමන ද? ','? ',' ජයග්රාහී ජෙනරාල්වරු විසින් ඉදි නව විහාරස්ථාන බොහෝ වූ දේ යුද්ධයේ ප්රතිඵලයක් ලෙස? ']","[[{ 'පෙළ' 'ප්රභූ', 'answer_start': 63}], [{ 'පෙළ' 'පල්ලිය හා රාජ්යය', 'answer_start': 128}], [{ 'පෙළ' 'ක්රි.පූ 509-27 ',' answer_start ': 189}], [{' පෙළ '' බ්රහස්පති ',' answer_start ': 822}], [{' පෙළ '' Punic යුද්ධ ',' answer_start ': 874}]]"
"යූ ටියුබ් සැන් බෲනෝ, කැලිෆෝනියා, එක්සත් ජනපදය මූලස්ථානය කරගත් ගෝලීය වීඩියෝ හුවමාරු වෙබ් අඩවියක්. මෙම සේවාව දී නොවැම්බර් 2006 2005 පෙබරවාරි මස පේපැල් සමාගමේ හිටපු සේවකයන් තිදෙනෙක් විසින් නිර්මාණය කරන ලදී, එය එක්සත් ජනපදය $ බිලියන 1.65 සඳහා ගූගල් විසින් මිලදී ගෙන ඇත. යූ ටියුබ් දැන් ගූගල් අනුබද්ධිත සමාගම් වලින් එකක් ලෙස ක්රියාත්මක වේ. මෙම වෙබ් අඩවිය උඩුගත කරන්න, බලන්න, වේගය, කොටස්, සහ වීඩියෝ අදහස් ප්රකාශ කිරීම පරිශීලකයන් ඉඩ ලබා දෙන අතර, එය පරිශීලක-ජනනය හා සමාගම් විවිධ ප්රදර්ශනය කිරීමට WebM, H.264 / MPEG-4 නගරයට ආසන්නව, සහ Adobe Flash වීඩියෝ තාක්ෂණය භාවිතා කරයි මාධ්ය වීඩියෝ. ලබා ගත හැකි අන්තර්ගතයට වීඩියෝ ක්ලිප්, රූපවාහිනි දර්ශන, සංගීතය, වීඩියෝ, චිත්රපට පෙර හඳුන්වාදීම්, සහ එවැනි වීඩියෝ බ්ලොග් ලිවීම, කෙටි මුල් වීඩියෝ, සහ අධ්යාපන වීඩියෝ වැනි වෙනත් අන්තර්ගතයන් ඇතුළත් වේ.","[ 'කොහේද Youtube මූලස්ථානය? ',' යූ ටියුබ් නිර්මාණය කරන ලද්දේ කවදාද? ',' 2006 දී Youtube සඳහා ගූගල් වැටුප් කොපමණ කළේ? ',' වීඩියෝ බ්ලොග් වඩා වෙනත් හා හා අධ්යාපනික වීඩියෝ පට, YouTube හි ගත හැකි අන්තර්ගතය කුමක් ද? ',' කොහොමද YouTube දැන් ලෙස ක්රියාත්මක වන්නේ ව්යාපාර? 2006 දී යූ ටියුබ් ආරම්භ කළ සේවකයින් තුනක් වැඩ කිරීම සඳහා භාවිතා කළේ ',' කුමක්ද සමාගම? ',' එක්සත් ජනපදය $ බිලියන 1.65 සඳහා 2005 දී YouTube මිලදී කවුද? ', ""කවුද ගේ අනුබද්ධිත ගූගල් දැන් යටතේ ක්රියාත්මක කරන්නේ කෙසේද?"",' වෙන මොන තාක්ෂණය YouTube භාවිතය WebM සහ H.642 / MPEG-4 VAC හැර කරන්නේ? ']","[[{ 'පෙළ' 'සැන් බෲනෝ, කැලිෆෝනියා, එක්සත් ජනපදය', 'answer_start': 59}], [{ 'පෙළ' 'පෙබරවාරි 2005', 'answer_start': 157}], [{ 'පෙළ': 'එක්සත් ජනපදය $ බිලියන 1.65', 'answer_start': 218}], [{ 'පෙළ' 'කෙටි මුල් වීඩියෝ', 'answer_start': 634}], [{ 'පෙළ': ""ගූගල් අනුබද්ධිත සමාගම් වලින් එකක් ලෙස"", 'answer_start ': 256}], [], [], [], []]"
"වෙන්වීමේ පවුර ජෙෆර්සන් කරන ඒ එක්සත් ජනපද ශ්රේෂ්ඨාධිකරණය විසින් නැවත නැවතත් සඳහන් කර ඇත. රෙනෝල්ඩ් ආයතයෙහි. ඇමරිකා එක්සත් ජනපදය (1879) අධිකරණයට ජෙෆර්සන් ගේ අදහස් ""වාගේ [පළමු] ව්යවස්ථා සංශෝධනය හා විෂය පථය ක්රියාත්මක ක බලාධිකාරී ප්රකාශයක් ලෙස පිළිගත හැකිය."" මෙසේ ලිවීය . අධ්යාපන එවර්සන් v මණ්ඩලය (1947) දී, අධිකරණ හියුගෝ කළු මෙසේ ලිවීය: ""තෝමස් ජෙෆර්සන් වචනවලින් කියතොත්, නීතිය මගින් ආගම පිහිටුවීමට එරෙහිව වගන්තිය පල්ලිය හා රාජ්ය අතර වෙන්කිරීමේ තාප්පයක් ඉදි කිරීමට අදහස් කරන ලදී.""","[ 'කවුද වෙන්වීමේ බිත්ති ගැන ද විදහාපාන අගනා රූපකයකි කළ?', 'කුමක්ද එක්සත් ජනපද ශ්රේෂ්ඨාධිකරණය නැවත නැවතත් සඳහන් කර ඇත?', 'එක්සත් ජනපදය රෙනෝල්ඩ් එම නඩුව වූ විට.?', ""ලෙස ජෙෆර්සන් ගේ අදහස් ගැන අධිකරණය ලිවීම් කළ දේ එය ඉදි කිරීමට අදහස් කරන නීතිය මගින් ආගම පිහිටුවීමට එරෙහිව වගන්තිය කුමක්ද? '' පළමු වන සංශෝධනය හා විෂය පථය ක්රියාත්මක කිරීමට අදාළ? "", 'වෙන් ඇති බිත්ති ගැන ද විදහාපාන අගනා රූපකයකි ප්රතික්ෂේප කවුද?', 'එක්සත් ජනපද ශ්රේෂ්ඨාධිකරණය ඇත්තේ කුමන අධිකරණය නැවත නැවතත් ප්රතික්ෂේප? ',' රෙනෝල්ඩ් එම නඩුව වූ විට. එක්සත් ජාතීන්ගේ? ',' එය තුන්වන ආණ්ඩුක්රම ව්යවස්ථා සංශෝධනය හා විෂය පථය ක්රියාත්මක කිරීමට අදාළ ලෙස කුමක්ද ජෙෆර්සන් ගේ අදහස් ගැන අධිකරණය ලිව්වද? "", 'පිහිටුවීමට එරෙහිව වගන්තිය කුමක්ද 'නීතිය මගින් නොවන ආගම සකානමය කිරීම රිසි ක?]","[[{ 'පෙළ' 'ජෙෆර්සන්', 'answer_start': 0}], [{ 'පෙළ' 'ද විදහාපාන අගනා රූපකයකි', 'answer_start': 12}], [{ 'පෙළ' '1879', 'answer_start' : 128}], [{ 'පෙළ' 'බලාධිකාරී ප්රකාශ', 'answer_start': 206}], [{ 'පෙළ' 'පල්ලිය හා රාජ්ය අතර වෙන්කිරීමේ තාප්පයක්', 'answer_start': 459}], [ ], [], [], [], []]"
