Text,Questions,Answers
"එය ජාතික ආන්ඩු විසින් බැංකු ඇප දී බේරා ගැනීම වලක්වා, නමුත් කොටස් වෙලඳපොලවල් තවමත් ලොව පුරා වැටී තිබූ විශාල මූල්ය ආයතන, බිඳ වැටීම තර්ජනය කළා. බොහෝ ප්රදේශවල, නිවාස වෙලඳපොල ද නෙරපා හැරීමට, අත්පත්කර ගැනීම් හා දිගු විරැකියාව නිසා, දුක් වින්දා. ප්රධාන ව්යාපාර අසාර්ථක අර්බුදය සැලකිය යුතු කාර්ය භාරයක් ඉටු කලේ, එක්සත් ජනපද ඩොලර් ටි්රලියන ගනනක් ඇස්තමේන්තු පාරිභෝගික ධනය, හා ආර්ථික කටයුතුවල පසුබෑම 2008-2012 ගෝලීය ආර්ථික අර්බුදය ප්රධාන හා යුරෝපීය රාජ්ය නය අර්බුදය දායක ප්රතික්ෂේප කරයි. ද්රවශීලතා අර්බුදයක් ලෙස විද්යමාන වන අර්බුදය ක්රියාකාරී අදියර, බී.එන්.පී. පරිබාස් ""ද්රවශීලතා සම්පූර්ණ වාෂ්පීකරණය"" උපුටා දක්වමින් ආරක්ෂක අරමුදල් තුනක් වලින් මුදල් ආපසු අවසන් වන විට අගෝස්තු 9, 2007, දාතමින් කළ හැක.","[ 'විශාල මූල්ය ආයතන බිඳ වැටීම වළක්වා? ජාතික ආන්ඩු විසින් 2007 දී ක්රියාමාර්ගය කුමක්ද', 'බොහෝ ඇස්තමේන්තු කෙසේද පාරිභෝගික ධනය 2007 මූල්ය අර්බුදය හේතුවෙන් අහිමි වුණේ ඇයි?', 'දිනය මූල්ය ක්රියාකාරී අදියර යනු කුමක්ද අර්බුදය ද්රවශීලතා අර්බුදයක් ලෙස ආරම්භ? ',' 2007 අවසන් වන මූල්ය අර්බුදය පසුව ඇති වූ ගෝලීය ආර්ථික පසුබෑම කුමක්ද වසරේ? ',' කුමක්ද ද්රවශීලතා අර්බුදයක් උපුටා දක්වමින් 2007 දී ආරක්ෂක අරමුදල් තුනක් වලින් මුදල් ආපසු අවසන් බව එම සමාගමේ නම? ' ]","[[{ 'පෙළ' 'බැංකු ඇප', 'answer_start': 87}], [{ 'පෙළ' 'එක්සත් ජනපදය ඩොලර් ටි්රලියන ගනන්', 'answer_start': 398}], [{ 'පෙළ' 'අගෝස්තු 9, 2007 ',' answer_start ': 649}], [{' පෙළ '' 2012 '', '' answer_start ': 481}], [{' පෙළ '' බී.එන්.පී. පරිබාස් ',' answer_start ': 670}]]"
"පෘතුගාලය (පෘතුගීසි: [puɾtuɣaɫ]), නිල වශයෙන් පෘතුගීසි ජනරජය (පෘතුගීසි: República Portuguesa), නිරිත යුරෝපය තුළ දී, අයිබීරියන් අර්ධද්වීපයේ රටක්. එය දකුණු සහ ස්පාඤ්ඤය විසින් උතුරු හා නැගෙනහිර බටහිරින් අත්ලාන්තික් සාගරයේ මායිම් කොට භූමි යුරෝපයේ westernmost රට, හා. මෙම පෘතුගාලය-ස්පාඤ්ඤය දේශ 1.214 ක් (754 සැත) ක් දිග වන අතර, යුරෝපා සංගමය තුල දිගම දේශසීමාව සලකා බලන ලදී. ජනරජ ද Azores හා Madeira අත්ලාන්තික් කොදෙව්, තමන්ගේ ම ප්රාදේශීය ආන්ඩු සමග දෙකම ස්වාධීන කලාපවල ඇතුළත් වේ.","[ 'සාගර පෘතුගාලය දේශ කරන්නේ කුමක්ද?', 'පෘතුගාලය දේශ කරන්නේ වෙනත් රට කුමක්ද?', 'කුමක්ද යුරෝපා සංගමය තුල දිගම දේශසීමාව ද?', 'පෘතුගාලය කොහේද?', 'කොපමණ කාලයක් පෘතුගාලය-ස්පාඤ්ඤය දේශ සීමා? ',' කුමක්ද ස්වාධීන කලාපවල දෙකක් පෘතුගාලයේ තමන්ගේ ම ආන්ඩු ද? ']","[[{ 'පෙළ' 'අත්ලාන්තික් සාගරය', 'answer_start': 242}], [{ 'පෙළ' 'ස්පාඤ්ඤය', 'answer_start': 286}], [{ 'පෙළ' 'පෘතුගාලය-ස්පාඤ්ඤයේ, 'answer_start': 319}], [{ 'පෙළ' 'අයිබීරියන් අර්ධද්වීපය, නිරිත යුරෝපයේ', 'answer_start': 127}], [{ 'පෙළ' '1.214 ක් (සැතපුම් 754)', 'answer_start': 344}], [{ 'පෙළ' 'Azores හා Madeira', 'answer_start': 502}]]"
"මානව හිතවාදී තනි තනිව හා සාමූහිකව, මානව වර්ගයාගේ වටිනාකම සහ ආයතනය අවධාරණය කරයි බව දාර්ශනික සහ සදාචාරාත්මක ස්ථාවරය වන අතර, සාමාන්යයෙන් බැහැර හෝ මිථ්යා විශ්වාසයන් පිළිගැනීම වැඩි විවේචනාත්මක චින්තනය සහ සාක්ෂි (යථාර්ථවාදය, empiricism) වඩාත් කැමති වෙයි. ඒ සමඟ හඳුනාෙගන ඇති රජයන් බුද්ධිමය ව්යාපාර අනුව කාලීන මානවවාදයෙන් අර්ථය උච්ඡාවචනය කර ඇත. සාමාන්යයෙන්, කෙසේ වෙතත්, මානව හිතවාදී, මානව නිදහස සහ ප්රගතිය සමහර සංකල්පය තහවුරු කරන බව ඉදිරිදර්ශනයක් සඳහන් කරයි. නවීන කාලවලදී, මානවහිතවාදී ව්යාපාර සාමාන්යයෙන් ලෞකිකත්වයට සමඟ align වී ඇති අතර අද මානව හිතවාදී සාමාන්යයෙන්-theistic නොවන ජීවිතය ස්ථාවරය සඳහන් මානව ආයතනය කේන්ද්ර හා ලෝකය අවබෝධ කර ගැනීමට ඇති ආශ්චර්යමත් ප්රභවය එළිදරව් කිරීමට විද්යාව වඩා බලා.","[ 'කුමක්ද මානවවාදයෙන් ක ප්රගුණ කිරීමට අත්යවශ්ය වැදගත් ලෙස දැකිය හැක්කේ කෙසේද?', 'කුමක්ද මානවවාදයෙන් පොදු අඳ ද?' ',' මේ දින මානව හිතවාදී දේ ක්රමයක් ලෙස දැකිය හැකි විය? ',' සඳහා බැර කළ හැකි දේ මානවවාදයෙන් අර්ථ දැක්වීම වෙනස්කම්? ',' වෙනුවට දේ මානවවාදයෙන් හැරීම ආත්මික හෝ දිව්යමය ප්රභවය අදහන්නේ දෙසට හැරෙමින්? ',' මානවවාදයෙන් වන්නට කිසිදු වැදගත් ලෙස දැකිය හැක්කේ කුමක්ද? ',' කුමක්ද මානවවාදයෙන් ව්යාජ අඳ ද? ',' කුමක්ද මානවවාදයෙන් අර්ථ දැක්වීම වෙනස්කම් මත කිසිදු බලපෑමක් ඇති කුමක්ද මානවවාදයෙන් තවදුරටත් ක්රමයක් ලෙස දැකිය ද? ','? ',' කුමක්ද මානවවාදයෙන් වෙනුවට ආත්මික හෝ දිව්යමය ප්රභවය රාජපාක්ෂිකභාවය හෙලා දකින කරන්නේ කුමක්ද? ']","[[{ 'පෙළ' 'මිනිසුන්', 'answer_start': 87}], [{ 'පෙළ' 'නිදහස සහ ප්රගතිය', 'answer_start': 470}], [{ 'පෙළ' 'ලෞකිකත්වයට', 'answer_start': 555}], [{ 'පෙළ' 'බුද්ධිමය ව්යාපාර', 'answer_start': 329}], [{ 'පෙළ': 'විද්යාව', 'answer_start': 672}], [], [] , [], [], []]"
"පොළොව මුලින්ම හේතුවෙන් අන්ත ගිනිකඳු හා අනෙකුත් ආයතන සමග නිතර නිතර ඝට්ටන උණු විය. අවසානයේදී, මෙම ග්රහ ලෝකයේ පිටත තට්ටුව ජලය වායුගෝලය තුල රැස් ආරම්භ විට කබොල්ලක් පිහිටුවීමට සිසිල්. සඳ හැකි පෘථිවි ස්කන්ධයෙන් 10% ක් පමණ glancing පහරක් දී ග්රහ බලපෑම් ඇතිවන සමග අඟහරු ප්රමාණයේ වස්තුව කිරීමේ ප්රතිඵලයක් ලෙස, ඉතා ඉක්මනින් පසුව පිහිටුවා ගත්හ. මෙම වස්තුව ස්කන්ධයෙන් සමහරක් වන්නේ එහි ඇති අභ්යන්තර සංයුතිය සැලකිය යුතු ආකාරයට වෙනස් කිරීම, පෘථිවිය සමග ඒකාබද්ධ, සහ කොටසක් අභ්යවකාශයට පිටකරන විය. ද්රව්යමය ලද සමහරක් වටා පරිභ්රමණය වන සඳ පිහිටුවීමට බේරුණා. නිපදවෙන රේඩෝන් හා ගිනිකඳු ක්රියාකාරකම් කල්පිත වායුගෝලය ඉදිරිපත්. ජල වාෂ්ප ඝනීභවනය, වල්ගා තරු ගැලවීමට අයිස් මගින් වර්ධනය, සාගර ඉදිරිපත්.","[ '? සඳ මහජන පොළොව සමාන කරන්නේ කොහොමද', 'කුමක්ද පොළොවේ පිටතින් ඒ සිසිල් පසුව පිහිටුවන?', 'පොළොව ආරම්භක රාජ්ය කුමක් ද? විය', 'කුමක්ද පොළොව මත ආදි කල්පිත වායුගෝලය නිර්මාණය? earths සාගර නිර්මාණය කිරීමට උදව් දේ ප්රභවය සිට ',' අයිස්? ',' වාත්තු වීමට Earths මුල් පෘෂ්ඨයේ හේතු වුණේ කුමක්ද? ',' ජලය එකතු කිරීමට ඉඩ සිසිල් කුමක්ද? ',' ජලය මතුපිට පොදිගසා ආරම්භ කරන විට සිදු වූයේ කුමක්ද? ',' කුමක්ද පොළොව කැබැල්ලක් කඩා සඳ පිහිටුවීමට හේතු? ',' සඳ ස්කන්ධය earths මහා සමාන කරන්නේ කෙසේද? ']","[[{ 'පෙළ' 'වාත්තු', 'answer_start': 20}], [{ 'පෙළ' 'ඝන පෘෂ්ඨයේ', 'answer_start': 152}], [{ 'පෙළ': 10% ක් පමණ "" පෘථිවි ස්කන්ධය "", 'answer_start': 299}], [{ 'පෙළ' 'නිපදවෙන රේඩෝන් හා ගිනිකඳු ක්රියාකාරකම්', 'answer_start': 563}], [{ 'පෙළ' 'කේතු', 'answer_start': 688} ], [], [], [], [], []]"
"පොලිස් බලය නීතිය, රැකවරණය දේපළ හා සීමාව සිවිල් ආබාධයක් ක්රියාත්මක කිරීම සඳහා රජය විසින් බලය පුද්ගලයන් පිහිටුවා ශරීරය වේ. , තම බලය බලය නීත්යානුකූල භාවිතය ඇතුළත් වේ. මෙම පදය බොහෝ පොදුවේ වගකීම පිළිබඳ අර්ථ නීතිමය හෝ භෞමික ප්රදේශය තුළ රාජ්ය පොලිස් බලය පාවිච්චි කිරීමට බලය ඇති බව ස්වෛරී රාජ්යයක පොලිස් සේවා සමඟ සංෙයෝජිත ෙකෙර්. පොලිස් හමුදා බොහෝ විට විදේශ ආක්රමනිකයන් එරෙහිව රාජ්ය ආරක්ෂක සම්බන්ධ හමුදා හෝ වෙනත් සංවිධාන වලින් වෙන වෙනම ලෙස අර්ථ නිරූපනය කර ඇත; කෙසේ වෙතත්, අමනුස්සයෝ වෙන්න සිවිල් පොලිස් චෝදනා හමුදා ඒකක වේ.","[ 'රාජ්ය කරන්න පොලිස් බලකායක් අවශ්ය ද? කුමක්ද', 'කුමක්ද සිට පොලීසිය සාමාන්යයෙන් වෙන් කරන්නේ?' '' 'කුමක්ද අමනුස්සයෝ වෙන්න ද?' ',' 'රාජ්ය කරන්න එපා පොලිස් බලකායක් අවශ්ය කුමක්ද කරන්නේ කුමක්ද?', 'කුමක්ද ජනාධිපති පොලිස් බලකායක් කරන්න ඕන? ',' කුමක්ද අමනුස්සයෝ වෙන්න නේද? ',' කුමක්ද පොලීසිය සාමාන්යයෙන් එකට ද? ',' කුමක්ද පොලිස් වෙන් කවදාවත් ද? ']","[[{ 'පෙළ': 'answer_start' 'නීතිය, රැකවරණය දේපළ හා සීමාව සිවිල් ආබාධයක් ක්රියාත්මක': 74}], [{ 'පෙළ' 'සිවිල් පොලිස් චෝදනා හමුදා ඒකක', 'answer_start': 567} ], [{ 'පෙළ' 'හමුදා හෝ විදේශීය ආක්රමනිකයන් එරෙහිව රාජ්ය ආරක්ෂක සම්බන්ධ අනෙකුත් සංවිධාන', 'answer_start': 445}], [], [], [], [], []]"
"වර්ග සංහාරය ජාත්යන්තර සබඳතා භාවිතා නිල කාලීන බවට පත් වී තිබේ. වර්ග සංහාරය යන වචනය මෙම පෙර 1944 පෙර භාවිතා නොවේ, 1941 දී, වින්ස්ටන් චර්චිල් යුද්ධය හා සිවිල් වැසියන් රුසියානු සිරකරුවන් සමූහ වශයෙන් ඝාතනය ලෙස ""අපරාධයක් නමක් නැති"" විස්තර. එම වසරේ දී, රෆායෙල් Lemkin නම් පෝලන්ත යුදෙව් නීතිඥයෙක්, ජන සංහාරය වැනි නාසීන් විසින් පිහිටුවන ක්රමානුකූලව ඝාතනය ප්රතිපත්ති විස්තර. වර්ග සංහාරය යන වචනය, ග්රීක උපසර්ගය geno- (තේරුම ගෝත්රය හෝ ජාතිය) සහ caedere (ඝාතනය කිරීමට ලතින් භාෂාවෙන්) සංයෝජන ය. යන වචනය පැවැත්ම සිට සමස්ත පිරිසක් ඉවත් කිරීමට හෝ විනාශ කිරීමට ගත් උත්සාහය සමග කිසියම් පිරිසක් එරෙහිව සිදු කරන බව දරුණු අපරාධ පිලිබඳ විශේෂිත ලෙස අර්ථ දක්වා ඇත.","[ '' වර්ග සංහාරය 'යන වචනය කුමක් වසර වන තෙක් නොදන්නා ද?', '1941 දී, කොහොමද වින්ස්ටන් චර්චිල් යුද්ධය රුසියානු සිරකරුවන් මහා ඝාතන හැඳින්වූයේ ඇයි?', 'කුමක්ද පළමු විස්තර කළ පෝලන්ත යුදෙව් නීතිඥයෙකු වූ නම ලෙස නාසි කුරිරු ක්රියා ""වර්ග සංහාරය?"" ',' කුමක්ද යන වචන ආකාරා පදනම ""වර්ග සංහාරය?"" එය ඉලක්ක කණ්ඩායම් එරෙහිව ප්රචන්ඩ අපරාධ වලට අදාල වන පරිදි, ජන සංහාරය පිළිබඳ ක්රියා තුළ අවසාන පෙළඹවීම කුමක්ද යනු ','? ',' 'වර්ග සංහාරය' පසුගිය වචනය වූ විට දක්වා ප්රසිද්ධ ""වර්ග සංහාරය"" යන වචනය කුමක්ද වසරේ භාවිතා? ',' නැහැ යන වචනය භාවිතා කවුද ""වර්ග සංහාරය""? ',' 1945 දී වර්ග සංහාරය ක්රියා සඳහන් කවුද? ','? ',' මොන විශේෂිත වන පරිදි අර්ථ දක්වා ඇත ? ෙකළවෙර් ""යුද සිරකරුවන්"" ප්රථම වරට භාවිතා කරන විට පැවැත්ම සිට සමස්ත පිරිසක් ඉවත් කිරීමට හෝ ඒවා වැඩි කර ගැනීමට උත්සාහ කිරීම සමග කිසියම් පිරිසක් එරෙහිව සිදු කරන බව දරුණු අපරාධ ','? ක ',' කුමක්ද ""සිරකරුවන් නිර්වචනය වන්නේ "" ',' මෙම වාක්ය?"" යුද සිරකරුවන් ""කුමක් වසර වන තෙක් නොදන්නා ද? යුද්ධය""? ',' කවුද යන වාක්ය යන වදනේ ""යුද සිරකරුවන් ',' 1941 දී, කොහොමද රෆායෙල් Lemkin රුසියානු මහා ඝාතන හැඳින්වූයේ ඇයි යුද සිරකරුවන්? ']","[[{ 'පෙළ' '1944', 'answer_start': 110}], [{ 'පෙළ': 'answer_start' ' ""නමක් නැති අපරාධ"" ලෙස': 225}], [{ 'පෙළ': 'රෆායෙල් Lemkin', 'answer_start': 297}], [{ 'පෙළ' 'ග්රීක උපසර්ගය geno- (තේරුම ගෝත්රය හෝ ජාතිය) සහ caedere (ඝාතනය කිරීමට ලතින් භාෂාවෙන්)', 'answer_start': 435}], [{ 'පෙළ' 'පැවැත්ම සිට සමස්ත පිරිසක් ඉවත් කිරීමට හෝ විනාශ කිරීමට', 'answer_start': 636}], [], [], [], [], [], [], [], [ ], [], []]"
"Saint-බර්තලමි (ප්රංශ: ශාන්ත-බර්තලමි, ප්රංශ උච්චාරණය: [sɛbaʁtelemi]), නිල වශයෙන් Saint-බර්තලමි (ප්රංශ: Collectivité territoriale ද ශාන්ත-බර්තලමි) භෞමික සාමූහික, ප්රංශයේ විදේශ සාමූහික වේ. බොහෝ විට ප්රංශ Saint-බාත්, හෝ ඉංග්රීසි ශාන්ත Barts හෝ ශාන්ත Barths කිරීමට සංක්ෂිප්ත, ආදිවාසීන් Ouanalao දිවයිනේ හමුවිය. ශාන්ත මාටින් හා ශාන්ත කිට්ස් උතුරු 35 කිලෝමීටර (22 mi) දුරින් ගැන ශාන්ත බර්තලමි බොරු. පෝටෝ රිකෝ මහ ඇන්ටිලස් බටහිරින් කිලෝමීටර 240 (සැතපුම් 150 ක්) වේ.","[ 'Saint-බර්තලමි කවෙර්ද; ක්රෙග් කුමක්ද රටක්', 'කුමක්ද Saint-බර්තලමි සඳහා ප්රංශ පලාෙත් ෙකටි නාමය ද?', 'භාෂාව දී ශාන්ත බර්තලමි abbreviate ශාන්ත Barts ද?', 'ශාන්තුවරයන්ගේ දේශීය ජනයා කළ දේ දිවයිනේ කතා -Barthélemy? ',' වන දිශාව Saint-බර්තලමි දිවයිනේ සිට පෝටෝ රිකෝ ද? ',' කොතරම් දුර ශාන්ත මාටින්ද සිට ශාන්ත කිට්ස් ද? ',' සෙන්ට් කිට්ස් සිට පෝටෝ රිකෝ කොතරම් දුරට ද? ',' කොතරම් දුර Saint-බර්තලමි ප්රංශයේ සිට ද? ',' කුමක් දිශාවට ශාන්ත Barts සිට ප්රංශය ද? ',' පෝටෝ රිකෝ ආදිවාසීන් ඔවුන්ගේ දිවයිනේ කතා කළේ කුමක්ද? ']","[[{ 'පෙළ' 'ප්රංශය', 'answer_start': 232}], [{ 'පෙළ' 'ශාන්ත බාත්', 'answer_start': 261}], [{ 'පෙළ' 'ඉංග්රීසි', ' answer_start ': 314}], [{' පෙළ '' Ouanalao ',' answer_start ': 363}], [{' පෙළ '' බටහිර ',' answer_start ': 515}], [], [], [ ], [], []]"
"ටජිකිස්තානය, (i / tɑːdʒiːkᵻstɑːn /, / tədʒiːkᵻstæn / හෝ / tædʒiːkiːstæn /; පර්සියානු: تاجيكستان Тоҷикистон [tɔd͡ʒikɪstɔn]), ටජිකිස්තාන නිල ජනරජය (පර්සියානු: جمهورى تاجيكستان ටජික්: Ҷумҳурии Тоҷикистон, Çumhuriji Toçikiston / Jumhuriyi Tojikiston; රුසියානු: Республика Таджикистан, Respublika Tadzhikistan), 2013 දී ඇස්තමේන්තුගත මිලියන 8 ක් පමණ මිනිසුන් හා 143.100 km2 (55,300 වර්ග සැතපුම්) ක භූමි මධ්යම ආසියාවේ කඳුකර, රටකි. එය, නැගෙනහිරින් බටහිරට දකුණු ඇෆ්ගනිස්ථානය මායිම් වන්නේ, උස්බෙකිස්තානය, උතුරු කිර්ගිස්තානය, චීනය. පකිස්ථානය පටු Wakhan කොරිඩෝව වෙන් දකුණේ පිහිටා ඇත. ටජික් ජනතාවගේ සාම්ප්රදායික ජාතිකයන් වර්තමාන ටජිකිස්තානය, ඇෆ්ගනිස්ථානය හා උස්බෙකිස්තානය ඇතුළත් විය.","[ 'ටජිකිස්ථානය පිහිටා තිබෙන්නේ කොහේද?', 'ටජිකිස්ථානය ජනතාව කොපමණ ජීවත් කරන්නේ?', 'ටජිකිස්තාන ප්රදේශයේ යනු කුමක්ද?', 'රටට බොරු Tajikistans නැගෙනහිර?', 'කුමක්ද ටජිකිස්තානය හා පාකිස්තානය seperates?', ' කුමන රටේ මධ්යම ආසියාවේ කඳුකර, සාගර භූ විසින් අර්ථ? ',' ටජිකිස්ථානය දේ වසරේ රුපියල් මිලියන 18 ක පමණ ජනතාව විසින්? ',' Talick ජනතාවගේ සම්ප්රදායික ජාතිකයන් ඇතුළත්? ',' කුමන මධ්යම අප්රිකාවේ රටේ පිහිටා ඇත 143.100 km2? ',' 153.100 km2 කොපමණ වර්ග සැතපුම් සමාන ද? ']","[[{ 'පෙළ' 'මධ්යම ආසියාවේ', 'answer_start': 355}], [{ 'පෙළ' 'මිලියන 8 ක් පමණ මිනිසුන්', 'answer_start': 389}], [{ 'පෙළ': ක 'ප්රදේශයේ 143.100 km2 (55,300 වර්ග සැතපුම්) ',' answer_start ': 422}], [{' පෙළ '' චීනය ',' answer_start ': 555}], [{' පෙළ '' Wakhan කොරිඩෝව ',' answer_start ': 626}], [], [], [], [], []]"
