Text,Questions,Answers
"රෙපරමාදු රෙපරමාදු ප්රතිසංස්කරණය සමඟ බිහිවූ ක්රිස්තියානි ඇදහිල්ල හා ක්රියාව පිළිබඳ ආකෘති පත්රය, [a] එහි අනුගාමිකයන් රෝමානු කතෝලික සභාවේ වැරදි ලෙස සලකනු දේ එරෙහිව ව්යාපාරය යි. එය ක්රිස්තියානි, රෝමානු කතෝලික සහ නැගෙනහිර ඕතොඩොක්ස් සමග එක්ව ප්රධාන අංශ තුනෙන් එකකි. Anglicanism සමහර විට මාටින් ලූතර්ගේ ඉගැන්වීම් තිරිසනුන් ලෙස හෙළා දකිමින් කළ නියෝගයක් එරෙහිව 1529 දී ලූතරන් අධිපතීන් සිට විරෝධතාව ලිපිය සිට කාලීන පදනම්වන්නේ මෙම රෙපරමාදු සිට ස්වාධීන ලෙස සැලකේ. [ආ].","[ 'විශ්වාසය කුමන ආකාරයේ රෙපරමාදු ද?' ',' 'වරක් තිරිසනුන් ලෙස සලකන ලදී? කාගේ ඉගැන්වීම්' '' රෙපරමාදු වඩා වෙනත්, කුමක් ක්රිස්තියානි අනෙක් අංශ දෙකක්? ', මාටින් ලූතර් හෙළා විරෝධතා ලිපියක් ලිව්වේ කවුද ? ',' කුමක්ද රෙපරමාදු ආරම්භ කළ ව්යාපාරයේ නම? ']","[[{ 'පෙළ' 'ක්රිස්තියානි', 'answer_start': 27}], [{ 'පෙළ' 'මාටින් ලූතර්', 'answer_start': 512}], [{ 'පෙළ' 'රෝමානු කතෝලික සහ නැගෙනහිර ඕතොඩොක්ස් ',' answer_start ': 270}], [{' පෙළ '' ලූතරන් අධිපතීන් ',' answer_start ': 442}], [{' පෙළ '' රෙපරමාදු ප්රතිසංස්කරණය ',' answer_start ': 78}]]"
"වෙනි සමුළුව බ්රසීලියාහි (පෘතුගීසි උච්චාරණය: [bɾaziljɐ]) බ්රසීලයේ ෆෙඩරල් අගනුවර සහ ෆෙඩරල් දිස්ත්රික් රාජ්ය වාසස්ථානය වේ. නගරය රටේ මධ්යස්ථානය-බටහිර කලාපයේ බ්රසීලියානු කඳුකරයේ මුදුනේ පිහිටා ඇත. එය නව ජාතික අගනුවර ලෙස සේවය කිරීම සඳහා, 1960 අප්රේල් මස 21 වන දින ආරම්භ කරන ලදී. වෙනි සමුළුව බ්රසීලියාහි සහ එහි මෙට්රෝ (ෆෙඩරල් දිස්ත්රික්කයේ මුළු ක්රිව) එය බ්රසීලයේ 4 වන වඩාත් ජනාකීර්ණ නගරයක් බවට 2011 දී 2.556.149 ක ජනගහනයක් ඇත. ප්රධාන ලතින් ඇමරිකානු නගර අතර වෙනි සමුළුව බ්රසීලියාහි R හි වැඩිම ඒක දළ දේශීය නිෂ්පාදිතයෙන් $ 61,915 (ඇමෙරිකානු $ 36,175) ඇත.","[ ""බ්රසීලයේ අගනුවර කුමක්ද? ',' Brasilia දී? වන්නේ බ්රසීලයේ කුමක්ද කලාපයේ ',"" එක්සත් ජනපද ඩොලර් ඒක පුද්ගල Brasilia දළ දේශීය නිෂ්පාදිතයෙන් යනු කුමක්ද? "","" Brasilia ගේ මෙට්රෝ ප්රදේශයේ ජනතාව යනු කුමක්ද? "",' Brasilia ආරම්භ කරන ලද්දේ කවදාද ? ',' පෘතුගීසින් දිස්ත්රික් බ්රසීලයේ අගනුවර කුමක්ද? ',' කෝ Brasilia ගේ මෙට්රෝ පිහිටා ඇත? "", 'Brasilia මෙට්රෝ ලෙස සේවය කිරීමට ආරම්භ කරන ලද්දේ කවදාද?' ',"" Brasilia ෆෙඩරල් දිස්ත්රික් ජනගහනය යනු කුමක්ද? "",' 1960 දී Brasilia සහ එහි මෙට්රෝ ජනගහනය කුමක්ද? ']","[[{ 'පෙළ' 'වෙනි සමුළුව බ්රසීලියාහි', 'answer_start': 0}], [{ 'පෙළ' 'මධ්යස්ථානය-බටහිර', 'answer_start': 196}], [{ 'පෙළ' 'එක්සත් ජනපදය $ 36.175', 'answer_start': 538}], [{ 'පෙළ' '2,556,149', 'answer_start': 383}], [{ 'පෙළ' 'අප්රේල් මස 21, 1960', 'answer_start': 237}], [], [], [], [], []]"
"ග්රීසියේ සේවය (82.8%) මත පදනම් වූ ආර්ථිකය සහ කාර්මික අංශ (13.3% ක්) සමග සංවර්ධිත රටක්. කෘෂිකාර්මික අංශය 2015 වැදගත් ග්රීක කර්මාන්ත, ජාතික ආර්ථික නිමැවුම් 3.9% සංචාරක හා නාවික ඇතුළත් දායක විය. 2013 දී අන්තර්ජාතික සංචාරකයන් මිලියන 18 ක් සමග, ග්රීසියේ ලෝකයේ, යුරෝපා සංගමය හා 16 වැනි, 7 වැනි වැඩිම සංචාරය රට විය. ග්රීක මර්චන්ට් නාවික හමුදා ගෝලීය මෙම තෑගි බෙදා බෙදාහරින ලද 15% ක් ග්රීසිය හා ආසියාව අතර ජාත්යන්තර සමුද්රීය ප්රවාහන සඳහා ඉහළ ඉල්ලුමක් නාවික ක්ෂේත්රයේ පෙර නොවූ විරූ ආයෝජන ප්රතිඵලය වී ඇත්තේ 2013 වන විට ග්රීක අයත් යාත්රා සමග, ලොව විශාලතම වේ.","[ 'රටේ වර්ගය කුමක්ද ග්රීසිය?', 'ග්රීසියේ ආර්ථිකය මොන ප්රතිශතයක් සේවා මත පදනම් වේ? "","" කාර්මික අංශ කොපමණ ග්රීසියේ ආර්ථිකය සමන්විත වන? "",' කොපමණ ජාතික ආර්ථික නිමැවුම කෘෂිකාර්මික අංශයේ කළා ග්රීසිය 2015 දී දායක? ',' අන්තර්ජාතික සංචාරකයන් 2013 දී ග්රීසියට ගියේය කීයක්? ',' ග්රීසිය මහාද්වීපය කුමන ආකාරයේ? ',' ග්රීසියේ ආර්ථිකය මොන ප්රතිශතයක් සේවා ලබා ගෙන ඇත? "","" කොපමණ ග්රීසියේ නය වේ කාර්මික අංශය සමන්විත? "", 'කොහොමද ජාතික ආර්ථික නිෂ්පාදනය වැඩි ග්රීසියේ කෘෂිකාර්මික අංශයේ 2014 දී ඉවත් කළේ?', '2013 දී අන්තර්ජාතික සංචාරකයන් ග්රීසියේ සිරගත කරන ආකාරය බොහෝ?']","[[{ 'පෙළ' 'සංවර්ධනය', 'answer_start': 12}], [{ 'පෙළ': '82 .8% ',' answer_start ': 68}], [{' පෙළ ': '13 .3%', ' answer_start ': 99}], [{' පෙළ '' 3.9% ',' answer_start ': 143}], [{' පෙළ ': '18 මිලියන', 'answer_start': 247}], [], [] , [], [], []]"
"සකස්වුණ නීති හෝ සෙනේට් බහුතරයේ නායක ලෙස මෙන් නොව, හවුස් බහුතරයේ නායක තීරු බදු හා ප්රමුඛත්වය සභාවේ කථානායක ශෛලිය හා බලය මත පදනම්ව වෙනස් වේ. සාමාන්යයෙන්, කථානායක විවාදය සඳහා සහභාගි කලාතුරකින් බිම ඡන්දය නැත. සමහර අවස්ථාවල දී, බහුතරයේ නායකයින් කථානායක වඩා වඩාත් බලපෑම් එල්ල වී ඇති බවත්; කථානායක ඩෙනිස් හැස්ටර්ට් වඩා ප්රමුඛ වූ සැලකිය යුතු ටොම් ප්රමාද. මීට අමතරව, කථානායක නිව්ට් ගින්ග්රිච් සභාව බිම නීති අවස බලය පෙර නොවූ විරූ මට්ටමේ ඩික් Armey වෙත පවරා.","[ 'සභාවේ මිනිසුන්ගේ කථානායක dbate සහභාගි?', 'නිවසේ කථානායක වඩා වඩාත් බලපෑම් snate බහුතරයක් නායකයන් ද ??', 'නිව්ට් ගින්ග්රිච් බොහෝ වගකීම් ඛෙදා කළේ කවුද?', 'විට ටොම් නිවසේ කථානායක කවුද ප්රමාද බහුතරයේ නායක ද? ',' කොච්චර බලය ඩික් Armey කිරීමට ටොම් ප්රමාද නියෝජිතයා කළේ? ',' ටොම් ප්රමාද ඩික් Armey සභාව බිම පුරා බලය ලබා කුමක්ද? ',' සාමාන්යයෙන් සෙනේට් බහුතරයේ නායක කුමක් නැත්තේ ඇයි? ',' වඩා ඩෙනිස් හැස්ටර්ට් වඩාත් ප්රමුඛ කවුද? ',' මේ සතිය තුළ බහුතරයේ නායක රාජකාරි මොනවාද? ""]","[[{ 'පෙළ' 'සාමාන්යයෙන්, කථානායක විවාදය සහභාගී නොවේ', 'answer_start': 199}], [{ 'පෙළ' 'බහුතරය නායකයින් කථානායක වඩා වඩාත් බලපෑම් එල්ල වී ඇති', 'answer_start': 299 }], [{ 'පෙළ' 'ඩික් Armey', 'answer_start': 479}], [{ 'පෙළ' 'ඩෙනිස් හැස්ටර්ට්', 'answer_start': 415}], [], [], [], [], []]"
"ආර්මේනියානු ආර්මේනියාව සහ තත්වාකාර ස්වාධීන නගෝර්නෝ-කරබක් සමූහාණ්ඩුව ප්රධාන ජනගහනය අතර වේ. ජීවත් නවීන ආර්මේනියාව පිටත පූර්ණ හෝ අර්ධ ආර්මේනියානු සම්භවයක් මිලියන 5 ක පමණ ජනතාවගේ පුළුල් පරාසයක ඩයස්පෝරාව ඇත. රුසියාවේ විශාලතම ආර්මේනියානු ජනගහනය අද දින පවතින, එක්සත් ජනපදය, ප්රංශය, ජෝර්ජියා, ඉරානය, යුක්රේනය, ලෙබනනය, සිරියාව. ඉරානය හා පැරනි සෝවියට් රාජ්යයන් හැරෙන්නට, අද දවසේ ආර්මේනියානු ඩයස්පෝරාව ආමේනියානු ජන සංහාරය ප්රතිඵලයක් ලෙස ප්රධාන වශයෙන් පිහිටුවන ලදී.","[ 'කොහේද ආර්මේනියාව හැර ආර්මේනියානු බොහෝ දුරට ජීවත් වෙන්නේ?', 'ඇයි බොහෝ ආර්මේනියානු ආර්මේනියාව දාලා ගියේ?', 'කීයක් ආර්මේනියානු සජීවී පිටත ආර්මේනියාව සහ ජනරජයක් එය තුල?', 'බොහෝ අයදුම්කරුවෙකුට ආර්මේනියානු ජීවත් වන්නේ කොහේද?', 'කෝ කිරීමට රුසියානුවන් ආර්මේනියාව හැර ජීවත්? ',' සජීවී Ukranian සම්භවයක් ජනතාව කොපමණ රුසියාවේ? ',' ඇයි බොහෝ ආර්මේනියානු ඉරානය දාලා ගියේ? ',' ද නගෝර්නෝ-කරබක් සමූහාණ්ඩුව සම්භවයක් ඇත කුමක් සංක්රමණය? ',' මිනිසුන් ඇති කොහෙද එක්සත් ජනපද පිටත සංක්රමණය වූ ජනතාව? ']","[[{ 'පෙළ' 'නගෝර්නෝ-කරබක් සමූහාණ්ඩුව', 'answer_start': 81}], [{ 'පෙළ' 'මිලියන 5 ක පමණ', 'answer_start': 144}], [{ 'පෙළ' 'රුසියාවේ , එක්සත් ජනපදය, ප්රංශය, ජෝර්ජියා, ඉරානය, යුක්රේනය, ලෙබනනය, සිරියාව ',' answer_start ': 287}], [{' පෙළ '' ආමේනියානු ජන සංහාරය ',' answer_start ': 491}], [], [], [], [], []]"
"යෙහෝවා දෙවිගේ සාක්ෂිකරුවන් ප්රධාන ධාරාවේ ක්රිස්තියානි පැහැදිලි nontrinitarian විශ්වාස සමඟ millenarian restorationist ක්රිස්තියානි නිකායක් වේ. කණ්ඩායම ශුභාරංචි සම්බන්ධ බැතිමතුන්ගේ මිලියන 8.2 කට වඩා වැඩි, මිලියන 15 කට වඩා වැඩි වන සමුළුවට සහභාගි චරිත වු අතර, මිලියන 19.9 කට වඩා වැඩි වාර්ෂික අනුස්මරණ පැමිණීම පිළිබඳ ලොව පුරා සාමාජිකත්වය පවසයි. යෙහෝවා දෙවිගේ සාක්ෂිකරුවන්, බෘක්ලින්, නිව් යෝර්ක්, වැඩිමහල්ලන් පිරිසක් බයිබලයේ එහි අර්ථ මත පදනම් වූ සියලු ධර්මයන් අනිත්යයි වන යෙහෝවා දෙවිගේ සාක්ෂිකරුවන්ගේ පාලක මණ්ඩලය විසින් අධ්යක්ෂණය කර ඇත. ඔවුන්ගේ සාහිත්ය ඉඳහිට වෙනත් පරිවර්තන උපුටා දක්වන අතර උපුටා දක්වයි නමුත් ඔවුන්, ඔවුන්ගේ පරිවර්තනය, ශුද්ධ ලියවිල්ලෙහි නව ලොව පරිවර්තනය භාවිතා කිරීමට කැමැත්තක් දක්වයි. ඔවුන් ආමගැඩන් දී වත්මන් ලෝක ක්රමය විනාශ ආසන්න වන අතර, මේ පොළොව දෙවියන් වහන්සේගේ රාජ්යය ස්ථාපිත කිරීම මනුෂ්යත්වයට මුහුණ සියලු ගැටලු සඳහා එකම විසඳුම බව බව අප විශ්වාස කරනවා.","[ 'යෙහෝවා සාක්ෂිකරුවන් මොනවාද?', '' දෙවි සාක්ෂිකරුවන්ගේ විශ්වාසයන් වෙනස් වන ද? ',' බැතිමතුන්ගේ කීයක් ලොව පුරා කණ්ඩායම ප්රකාශය කරන්නේ? ',' යෙහෝවා සාක්ෂිකරුවන් යොමු කිරීමේ චෝදනා කවුද? ', කොහේද ',' කරන්න ',' යෙහෝවා දෙවි සාක්ෂිකරුවන් කොහෙද ආරම්භ කරන ලදී? පිහිටා? ',' බොහෝ යෙහෝවා සාක්ෂිකරුවන් බැතිමතුන්ගේ කෙසේද එක්සත් ජනපදයේ ජීවත් වන පිරිසක් වැඩිමහල්ලන්? යෙහෝවා සාක්ෂිකරුවන් බොහෝ එක්සත් ජනපදයේ ශුභාරංචි සම්බන්ධ වන්නේ කෙසේද? ',' කෝ ආමගැඩන් එහි ආරම්භය වනු ඇත යෙහෝවා සාක්ෂිකරුවන් විශ්වාස කරනවද? ']","[[{ 'පෙළ' 'millenarian restorationist ක්රිස්තියානි නිකායක්', 'answer_start': 25}], [{ 'පෙළ' 'ප්රධාන ධාරාවේ ක්රිස්තියානි', 'answer_start': 117}], [{ 'පෙළ' 'වඩා මිලියන 8.2 කි ',' answer_start ': 185}], [{' පෙළ ': ""පාලක මණ්ඩලයේ යෙහෝවා දෙවිගේ සාක්ෂිකරුවන්ගේ"",' answer_start ': 397}], [{' පෙළ '' බෘක්ලින් ',' answer_start ' : 457}], [], [], [], []]"
"ඩ්වයිට් දාවිත් 'Ike ""අයිසන් හවර් (/aɪzənˌhaʊ.ər/ ඇසින්-zən අයුරු-ər; ඔක්තෝබර් 14, 1890 - මාර්තු 28, 1969) 1953 සිට 1961 දක්වා එක්සත් ජනපදයේ 34 වන ජනාධිපති ලෙස කටයුතු කල ඇමරිකානු දේශපාලනඥයකු හා පොදු විය . ඔහු දෙවන ලෝක යුද්ධය අතරතුර දී එක්සත් ජනපදය යුද හමුදාවේ තරු පහේ සාමාන්ය වූ අතර යුරෝපයේ මිත්ර හමුදා උත්තරීතර හමුදාපති ලෙස සේවය කර ඇත. ඔහු බස්නාහිර පෙරමුණ 1944-45 දී සැලසුම් කිරීම හා 1942-43 දී Torch මෙහෙයුම උතුරු අප්රිකාව තුල ආක්රමනය, අධීක්ෂණය හා ප්රන්සය හා ජර්මනිය අතර සාර්ථක ආක්රමණය සඳහා වගකිව යුතු විය. 1951 දී, ඔහු නේටෝ පළමු ශ්රේෂ්ඨාධිකරණය හමුදාපති බවට පත් විය.","[ඉහළම තැනට (නිලය නොවේ) කුමක්ද දෙවන ලෝක යුධ සමයේ ""මොන අයිසන් හවර් සුරතල් නම ද?"", 'ඩ්වයිට් අයිසන්හවර් මැද නම කුමක්ද?' ', ""කුමක් වසරේ දී අයිසන් හවර් ජනාධිපති ආරම්භ කළේ ඇයි?', ', අයිසන්හවර් සාක්ෂාත් ? ',' කුමක්ද උතුරු අප්රිකානු ආක්රමණය අයිසන් හවර් අධීක්ෂනය නම ද? ']","[[{ 'පෙළ' 'Ike', 'answer_start': 14}], [{ 'පෙළ' 'දාවිත්ගේ', 'answer_start': 7}], [{ 'පෙළ' '1953', 'answer_start' : 196}], [{ 'පෙළ' 'යුරෝපයේ මිත්ර පාක්ෂික හමුදා උත්තරීතර හමුදාපති', 'answer_start': 300}], [{ 'පෙළ' 'මෙහෙයුම Torch', 'answer_start': 430}]]"
"බ්රොන්ක්ස් / brɒŋks / දකුණු වෙස්චෙස්ටර් පිහිටා නිව් යෝර්ක් ප්රාන්තයේ නිව් යෝක් නගරයේ ප්රදේශ අයිති පහ (කෝරල), පලාත් වේ. බොහෝ පාලම් සහ උමං ක්වීන්ස් මැන්හැටන් ඇති පටු හාර්ලම් ගඟට ඉහලින් හා යටතේ බටහිර මෑන්හැටන්, දිවයින සහ ඒක අරුම පුදුම කිරීමට බ්රොන්ක්ස් සබැඳෙයි මෙන්ම, දකුණු නැගෙනහිර ගඟ හරහා පාලම් ඉදිකිරීම තවදුරටත් තුනක්. ප්රදේශ අයිති පහක්, බ්රොන්ක්ස් එක්සත් ජනපද භූමියට එකම එකක් වන අතර, 2014 දී වර්ග සැතපුම් 42 ක භූමි ප්රදේශයක් (109 km2) සහ 1.438.159 ක ජනගහනයක් සහිත, සිව්වන විශාලතම භූමි සිව්වන වැඩිම ජනගහනය ඇති අතර, තෙවන වැඩිම ජන ඝනත්වය.","[ 'කීයක් යොවුන් සේනාංකයේ දී boroughs ද?', 'බ්රොන්ක්ස් යොවුන් සේනාංකයේ අතර ස්ථානගත වී තිබේ කොහෙද boroughs?', ""මොන බ්රොන්ක්ස් ජනගහනය ද?"", 'බ්රොන්ක්ස් කෙසේද විශාල ද?' ', ""මොන බ්රොන්ක්ස් පිහිටීම ගැන අද්විතීය වන්නේ ඇයි? ""]","[[{ 'පෙළ' 'පස්', 'answer_start': 47}], [{ 'පෙළ' ', උතුරු දිශාවට', 'answer_start': 27}], [{ 'පෙළ' '1.438.159', 'answer_start' : 507}], [{ 'පෙළ': වර්ග සැතපුම් '42 (109 km2) ',' answer_start ': 461}], [{' පෙළ '' ප්රදේශ අයිති පහම බ්රොන්ක්ස් එක්සත් ජනපදය මත පමණි භූමි ප්රදේශය ',' answer_start ': 367}]]"
